{
  "schema_version": "1",
  "id": "mcp-auth-003-method-header-body-mismatch",
  "title": "routing names a method the body did not request",
  "class": "MCP_AUTH_ATTACK",
  "surface": "PROTOCOL_BINDING",
  "property": "MCP.AUTH.PROTOCOL_BINDING",
  "expected_invariant": "MCP_METHOD_HEADER_BODY_BINDING_PRESERVED",
  "reference_behavior": "METHOD_HEADER_BODY_MISMATCH",
  "preconditions": [
    "mcp_current_protocol_present",
    "mcp_http_transport_present"
  ],
  "surface_note": "a gateway routes on transport metadata while the server executes the body",
  "safety_class": "SYNTHETIC_NOOP",
  "standards": [
    {
      "source": "MCP",
      "reference": "2026-07-28 authorization",
      "status": "NORMATIVE"
    }
  ]
}
