{
  "schema_version": "1",
  "id": "mcp-auth-021-scope-step-up-dropped-scope",
  "title": "a step-up retry that dropped a previously required scope",
  "class": "MCP_AUTH_ATTACK",
  "surface": "SCOPE_AND_REGISTRATION",
  "property": "MCP.AUTH.SCOPE_STEP_UP_INTEGRITY",
  "expected_invariant": "SCOPE_STEP_UP_DOES_NOT_DROP_REQUIRED_SCOPE",
  "reference_behavior": "SCOPE_STEP_UP_DROPPED_SCOPE",
  "preconditions": [
    "mcp_current_protocol_present",
    "mcp_http_transport_present"
  ],
  "surface_note": "a step-up retry silently discards privilege the request already required",
  "safety_class": "SYNTHETIC_NOOP",
  "standards": [
    {
      "source": "MCP",
      "reference": "2026-07-28 authorization",
      "status": "NORMATIVE"
    }
  ]
}
