{
  "schema_version": "1",
  "id": "mcp-auth-015-token-validity-evidence-missing",
  "title": "a token with no verification evidence was accepted anyway",
  "class": "MCP_AUTH_ATTACK",
  "surface": "TOKEN_BINDING",
  "property": "MCP.AUTH.TOKEN_AUDIENCE_RESOURCE_BINDING",
  "expected_invariant": "TOKEN_VALIDITY_EVIDENCE_PRESENT",
  "reference_behavior": "TOKEN_VALIDITY_EVIDENCE_MISSING",
  "preconditions": [
    "mcp_current_protocol_present",
    "mcp_http_transport_present"
  ],
  "surface_note": "a token is accepted with no recorded verification behind it",
  "safety_class": "SYNTHETIC_NOOP",
  "standards": [
    {
      "source": "MCP",
      "reference": "2026-07-28 authorization",
      "status": "NORMATIVE"
    }
  ]
}
