{
  "schema_version": "1",
  "id": "mcp-auth-016-compliant",
  "title": "PKCE S256 bound to its verifier",
  "class": "BENIGN_CONTROL",
  "surface": "FLOW_INTEGRITY",
  "property": "MCP.AUTH.PKCE_REDIRECT_STATE_INTEGRITY",
  "expected_invariant": "PKCE_BINDING_PRESERVED",
  "reference_behavior": "COMPLIANT",
  "preconditions": [
    "mcp_current_protocol_present",
    "mcp_http_transport_present"
  ],
  "surface_note": "a flow that stays inside every boundary it was granted",
  "safety_class": "SYNTHETIC_NOOP",
  "standards": [
    {
      "source": "MCP",
      "reference": "2026-07-28 authorization",
      "status": "NORMATIVE"
    }
  ]
}
