{
  "schema_version": "1",
  "id": "mcp-auth-001-compliant",
  "title": "a current-revision request whose routing matches its body",
  "class": "MCP_AUTH_ATTACK",
  "surface": "PROTOCOL_BINDING",
  "property": "MCP.AUTH.PROTOCOL_BINDING",
  "expected_invariant": "MCP_METHOD_HEADER_BODY_BINDING_PRESERVED",
  "reference_behavior": "COMPLIANT",
  "preconditions": [
    "mcp_current_protocol_present",
    "mcp_http_transport_present"
  ],
  "surface_note": "a flow that stays inside every boundary it was granted",
  "safety_class": "SYNTHETIC_NOOP",
  "standards": [
    {
      "source": "MCP",
      "reference": "2026-07-28 authorization",
      "status": "NORMATIVE"
    }
  ]
}
