{
  "schema_version": "1",
  "id": "mcp-auth-034-multiple-independent-violations",
  "title": "one flow crossing three independent boundaries at once",
  "class": "MCP_AUTH_ATTACK",
  "surface": "RESOURCE_AUTHORIZATION",
  "property": "MCP.AUTH.AUTHORIZATION_SERVER_BINDING",
  "expected_invariant": "AUTHORIZATION_RESPONSE_ISSUER_PRESERVED",
  "reference_behavior": "MULTIPLE_INDEPENDENT_VIOLATIONS",
  "preconditions": [
    "mcp_current_protocol_present",
    "mcp_http_transport_present"
  ],
  "surface_note": "one flow crossing several boundaries at once, each independently observable",
  "safety_class": "SYNTHETIC_NOOP",
  "standards": [
    {
      "source": "MCP",
      "reference": "2026-07-28 authorization",
      "status": "NORMATIVE"
    }
  ]
}
